"","id","Sp_no","LAT","LA2","LA3","LONG","LO2","LO3","LATDEC","LONGDET","ALT","SGRIDS","PRCODE","STATE","VGR","LOCALITY","HABITAT","SUBSTRATE","HOSTgenus","HOSTsp","HOSTcname","DAY","MONTH","YEAR","date.comments","oldID","BATCH","PHOTO","SPECIMEN","Checked","Initial","date.checked","Basis...specimen","Basis...photo","PhotoID","Submitted.as","date.entered","DENTRY","SS","SH","SL","COMMENTS","COLL.NO","DET","HERB.NO","LITauth","LITbibl","AHC","recorded_by","Doubtful.record","Book.or.REF","REF.Number"
"24394",41777,447,28,11,55,153,11,14,-28.19861111,153.1872222,"","LLG","2","QLD","","Bellbird Walk, Lamington","Rainforest","","","","",4,6,2007,"","",12,"","","1","","","","","","","12/12/08","GL","S","","","","","","","","",NA,904,"","",0
"14180",26342,45,17,6,0,145,46,0,-17.1,145.7666667,"","","3","QLD","","Gordonvale","","","","","",0,3,1970,"","",3,"","","1","","","","","","","8/6/04","CFR","","H","","","Crichton, S.J.","","MEL2058482","","",NA,903,"","",NA
"19728",36135,86,37,53,18,145,22,9,-37.88833333,145.3691667,"","MEL","2","VIC","","Sherbrooke Forest. Grants Picnic Ground","Mountain ash forest","Bark","Eucalyptus","regnans","Mountain ash",3,7,2006,"","",7,"N","N","1","","","","","","","30/10/06","GP","S","","","","","","","","",NA,760,"","",0
"14774",28788,311,37,9,43,139,51,32,-37.16194444,139.8588889,"","LLG","1","SA","","Woakwine CP, South east","Pinus radiata plantation","On fallen trunk","Pinus","radiata","Monterey Pine",31,5,1999,"","",35,"","","1","","","","","","","4/11/04","GP","S","","","","","","","","",6,49,"","",NA
"58027",1218563,12,NA,NA,NA,NA,NA,NA,-29.545604,152.924122,"","GOO","1","NSW","","The Pinnacles","Mixed Hardwood forest with sheoaks","Eucalyptus planchoniana, E. pyrocarpa, Allocasuarina littoralis.Thick layers of leaf litter","","","",26,7,2015,"","",1,"N","N","2","TM","25/10/17","","7","Aseroe rubra Author’s Garden","","12/1/18","GP","S","","","","","","","","",NA,2039,"","",0
"59848",1220362,2359,37,21,32,145,45,10,-37.35888889,145.7527778,"","DES","2","VIC","","Cathedral Range, Neds Gully, higher up along Neds track","Open Forest with Red Stringybark/ Broad-leaved Peppermint/Longleaved Box","ground","","","",12,8,2018,"","",187,"","","","","","","","","","26/9/18","GP","S","","","","","","","","",NA,178,"","",0
"52470",1212287,341,38,33,2,143,44,40,-38.55055556,143.7444444,"","LLG","2","VIC","","Great Otway NP. Lake Elizabeth, circuit around lake","Wet Sclerophyll Forest","wood","","","",21,5,2016,"","",164,"","","","","","","","","","10/6/16","GP","S","","","","","","","","",NA,178,"","",0
"179",1217087,170,34,59,0,138,42,0,-34.98333333,138.7,"","LLG","2","SA","","Mount Lofty Botanic Garden","","","","","",13,5,2017,"","",45,"","","","","","","","","","4/8/17","GP","S","","","","","","","","",NA,698,"","",0
"52442",1212259,498,38,33,2,143,44,40,-38.55055556,143.7444444,"","LLG","2","VIC","","Great Otway NP. Lake Elizabeth, circuit around lake","Wet Sclerophyll Forest","wood, fallen log","","","",21,5,2016,"","",164,"","","","","","","","","","10/6/16","GP","S","","","","","","","","",NA,178,"","",0
"56046",1216144,7,37,33,32,145,53,13,-37.55888889,145.8869444,"","LLG","2","VIC","","Cambarville, Cumberland walk","Wet Eucalypt forest with Mountain Ash (Eucalyptus regnans) and Rainforest with Myrtle Beech (Nothofagus cunninghamii).","Wood, base of stump","","","",23,4,2017,"","",177,"","","","","","","","","","12/5/17","GP","S","","","","","","","","",NA,178,"","",0
"19607",35967,153,41,53,30,145,33,0,-41.89166667,145.55,"","LLM","2","TAS","","Roger River Road to Kunannah Bridge and Temma.  Roger River Reserve.","Cool temperate mixed rainforest dominated by Eucalyptus.","on tree","","","",14,5,2006,"","",5,"N","N","4","TM","22/5/06","0","6","","92","19/9/06","WC","S","","","Can't be sure if it is Stereum hirsutum group.  Need to see orange underneath, which is not shown in the accompanying photo.","","","","","",NA,922,"","",0
"43561",120315,2058,37,59,0,145,12,0,-37.98333333,145.2,"","DES","2","VIC","","Dandy mushroom factory","","","","","",2,1,1974,"","",1,"","","1","","","","","","","1/5/15","GP","S","","","CSIRO Division of Forest Products Fungi Herbarium accession number #15603 (specimen not present or not retained when moved to MEL in 2000). Data from accession book held at RBG Melbourne.","Dillon, David","Walters, N.E.M.","","","",NA,1586,"","",0
"57939",1218485,2379,37,50,18,145,6,10,-37.83833333,145.1027778,"","MEL","2","VIC","","Wattle Park, Burwood","Remnnant/restored open forest","Soil","","","",17,6,2017,"","",36,"","","","","","","","","","12/1/18","GP","S","","","","","","","","",NA,760,"","",0
"49096",1206251,290,34,38,30,135,23,0,-34.64166667,135.3833333,"39","LLG","3","SA","","Eyre Peninsula. Coffin Bay NP","","","","","",23,7,2004,"","23/vii",49,"N","n","No","","","","","","","4/12/15","GP","S","","","","","","","","",NA,49,"","",0
"22633",39613,268,38,19,0,145,37,37,-38.31666667,145.6269444,"","LLG","2","VIC","","Near Nyora. Adams Creek Conservation Reserve off Hookers Road","Heathy woodland: Eucalyptus pryoriana, Leptospermum spp.","dead branch on ground","","","",4,7,2004,"","",35,"N","N","1","","","","","","","10/12/07","GP","S","","","","","","","","",NA,178,"","",0
"1715",1338,27,38,40,0,146,41,0,-38.66666667,146.6833333,"","LLM","","VIC","T44","Port Albert, South Gippsland","","in grass","","","",12,6,1999,"","EIC0086",17,"N","","1","","","","","","","30/7/99","PG","S","","","","","","","","",1,86,"","",NA
"27204",45069,7,36,11,14,150,4,3,-36.18722222,150.0675,"","LLG","1","NSW","","Cowdroy Creek","Remnant littoral rainforest","Decaying tree limb","","","",24,6,2007,"","",17,"","","2","","","","","","","17/5/10","GL","S","","","Regular species","","","","","",NA,534,"","",0
"57194",1217176,200,34,28,8,116,6,25,-34.46886111,116.1069944,"","GOO","1","WA","","Collins Road, 6.5kms NNE of Pemberton","Eucalyptus marginata, Corymbia calophylla, Agonis flexuosa, Allocasuarins fraseriana","soil","","","",8,6,2017,"","",30,"","","","","","","","","","4/8/17","GP","S","","","Katrina Syme and Lee Fontanini","","","","","",NA,78,"","",0
"5852",6095,37,35,28,0,148,54,0,-35.4667,148.9,"780","LLU","2","ACT","","Tidbinbilla Nature Reserve, 26km SW of Capital Hill ACT","Eucalypt woodland","","","","",28,6,1987,"","LEP0106",1,"","","","","","","","","","1/7/95","","S","","","","HL 82","","","","",NA,106,"","",NA
"49631",1206899,440,34,47,30,135,51,0,-34.79166667,135.85,"33","LLG","3","SA","","Eyre Peninsula. Lincoln NP","","","","","",6,8,2005,"","*6/viii",49,"","Y","No","","","","","","","16/12/15","GP","S","","","","","","","","",NA,49,"","",0
"47824",1204859,81,NA,NA,NA,NA,NA,NA,-22.640741,117.473005,"","LLG","1","WA","","IBRA Region: Pilbara. 8.4 km northeast of Mount Turner, 32.4 km west-northwest of Tom Price and 15.3 km west of the intersection of Nanutarra Wittenoom Road and Nameless Valley Drive","","On soil.","","","",26,10,2011,"","",2,"N","","1","","","","","","","4/12/15","GP","S","","","","","","","","",NA,1301,"","",0
"13343",24483,240,36,36,57,147,57,22,-36.61583333,147.9561111,"","","","VIC","","Alpine National Park, Benambra-Corryong Road, 1.6km S `Sassafras Gap, AWC Site 100, Mapsheet: Benambra 1:100000, Australian Map Grid 585500 Easting, 5947300 Northing.","Climate Zone: 3, Geological Type: ORD, Micro-topo: Gully. Tree species on plot: Acacia dealbata, Eucalyptus delegatensis, Eucalyptus pauciflora.","","","","",20,5,1997,"","",1,"","","1","","","","","","","21/4/04","CFR","","H","","Dirty brownish white, gleba concolorous to ivory. Odour of chlorine.","Mires, G.W., Jumpponen, A.M.","Lebel, T.","MEL 2126511","","",5,903,"","",NA
"59124",1219648,61,12,24,41,130,49,18,-12.41138889,130.8216667,"14","LLG","1","NT","","East Point, Alec Fong Lim Drive, East Point Mangrove Boardwalk.","","Wood","","","",22,6,2017,"","",3,"","","2","GP","","","7","IMG_3311","Unidentifiable","18/7/18","WC","S","","","","","","","","",NA,1572,"","",0
"3030",2840,62,37,8,56,142,22,34,-37.1489,142.3761,"","AMG","2","VIC","","Grampians: Burrong Falls Track","Dry forest under Eucalyptus cypellocarpa","On soil","","","",2,10,1997,"","KET0194",1,"N","","","","","","","","","1/3/98","PG","S","","","","","","","","",NA,194,"","",NA
"58588",1218848,6,37,48,27,144,8,35,-37.8075,144.1430556,"","GOO","2","VIC","","7 km north-east of Meredith, beside Eclipse Creek, approximately 500 m downstream of Whinray Road bridge.","Small creek flat","Soil","","","",10,5,2017,"","",37,"","","1","","","","","","","6/4/18","WC","S","","","","","","","","",NA,241,"","",0
"53244",1212926,372,27,4,57,152,57,24,-27.0825,152.9566667,"14","DES","2","QLD","","Caboolture, Mortimer Street.","","","","","",14,3,2016,"","",1,"N","N","3","GP","1/4/16","","7","20160330_105351","153","12/7/16","WC","S","","","","","","","","",NA,1848,"","",0
"17244",34715,46,37,46,28,145,3,6,-37.77444444,145.0516667,"","MEL","2","VIC","","Ivanhoe, Lower Heidelberg Rd","Suburban nature strip","On live tree","","","Queensland box",15,6,2005,"","",45,"N","N","2","TM","2/9/05","0","6","","","6/1/06","GP","S","","","","","","","","",NA,30,"","",0
"12652",25731,59,37,54,27,145,8,29,-37.9075,145.1413889,"","AMG","2","VIC","","Notting Hill. Blackburn Rd","Nature strip","Soil","","","",2,5,2003,"","",28,"N","N","","","","","","","","22/4/04","GP","S","","","","","","","","",NA,169,"","",NA
"41019",63597,69,37,50,2,145,5,31,-37.83388889,145.0919444,"","DES","2","VIC","","Surrey Hills, South Surrey Park.","","","","","",29,5,2012,"","",15,"N","N","1","","","","","","","1/4/14","WC","S","","","","","","","","",NA,524,"","",0
"6136",7405,76,37,2,12,142,43,59,-37.03666667,142.7330556,"","LLG","1","VIC","","South of Stawell; Black Ranges; Bunjils Cave Reserve","","on dead stick near Longleaf Box","","","",1,4,2001,"","",21,"N","N","1","","","","","","","17/12/01","GA","S","","","","","","","","",1,104,"","",NA
"40563",63218,903,26,52,44,151,35,48,-26.87888889,151.5966667,"1000","","2","QLD","","Bunya Bunya Loop","Araucarian microphyll vineforest","log","","","",27,3,2009,"","",2,"","","1","","","","","","","12/3/14","GP","S","","","","","","","","",NA,1287,"","",NA
"313",373,11,37,51,39,145,51,7,-37.8608,145.8519,"","AMG","2","VIC","S48","Central Highlands : Ada River","on log beside river","","","","",27,11,1995,"","WEA0043",4,"N","","","","","","","","","30/6/97","PG","S","","","","","","","","",NA,43,"","",NA
"18968",36627,77,31,56,53,115,46,46,-31.94805556,115.7795833,"","LLG","1","WA","","Bold Park and adjacent bushland","On live Tuart","base of a Tuart","Eucalyptus","gomphocephala","Tuart",26,6,2004,"","",1,"","","20","","","","","","","27/11/06","GP","S","","","","","","","","",NA,1129,"","",0
"16269",31432,54,41,23,42,145,48,23,-41.395,145.8063889,"390","LLG","2","Tas","","Birralee. Black Sugarloaf (Sonia's swamp)","Eucalypt forest","soil","","","",9,7,2004,"","",17,"","","1","","","","","","","23/3/05","GL","S","","","","","","","","",NA,640,"","",0
"27983",47425,428,38,45,21,143,33,16,-38.75583333,143.5544444,"","LLG","2","VIC","","Otway National Park, Mait's Rest.","Temperate rainforest with myrtle beech, messmate and tree ferns.","Dead Nothofagus.","Nothofagus","","Myrtle beech.",3,5,2009,"","",39,"N","N","1","","","0","4","428pg02","","27/7/10","WC","S","","","Photo stored on CD 56.","","","","","",NA,707,"","",0
"5453",5736,4,37,55,58,145,26,52,-37.93277778,145.4477778,"","AMG","2","VIC","N54","Emerald: Nobelius Packing Shed","Under Pinus radiata","","","","",0,0,1992,"","WEA0043",1,"","","1","","","","","","","16/5/96","","S","","","","","","","","",3,43,"","",NA
"20308",36879,93,37,59,6,145,35,41,-37.985,145.5947222,"","LLG","2","VIC","","Bunyip State Forest.  Mortimer Picnic Ground and nature trail.","Wet sclerophyll forest with mountain grey gum (Eucalyptus cypellocarpa).","Dead wood","","","",30,4,2006,"","",20,"N","N","1","","","","","","","28/11/06","WC","S","","","","","","","","",NA,178,"","",0
"366",1216721,1015,38,16,58,146,0,28,-38.28277778,146.0077778,"","LLG","2","VIC","","Mount Worth State Park, Moonlight Track","Tall wet forest of Mountain Ash Eucalyptus regnans, Hazel Pomaderris aspera, Blackwood Acacia melanoxylon and Silver Wattle Acacia dealbata and numerous Tree-ferns","wood","","","",4,6,2017,"","",180,"","","","","","","","","","18/7/17","GP","S","","","","","","","","",NA,178,"","",0
"9833",13971,69,37,49,33,145,9,37,-37.82583333,145.1602778,"100","AMG","2","VIC","","Blackburn Lake: near visitors centre, Central Road","In remnant Eucalyptus, with grassy / litter understorey","","","","",13,5,2000,"","",4,"","","1","","","","","","","27/2/03","GE","S","","","","","","","","",2,9,"","",NA
"36362",55455,538,36,33,48,143,51,20,-36.56333333,143.8555556,"160","LLG","1","VIC","","1.9km north-west of Inglewood, between Calder Highway and railway line at channel.","Eucalyptus polybractea and Eucalyptus behrii.  Bank of channel.","Mossy bank.","","","",19,8,2010,"","",3,"N","N","1","","","","","","","7/5/13","WC","S","","","","","","","","",NA,960,"","",0
"30240",49396,433,38,41,51,143,22,10,-38.6975,143.3694444,"","LLG","2","VIC","","Greater Otway NP. Melba Gully","Cool temperate rainforest dominated by Nothofagus cunninghamii","Fallen log","","","",1,5,2010,"","",90,"N","N","1","","","","","","","18/4/11","GP","S","","","","","","","","",NA,178,"","",0
"49624",1206892,484,35,53,30,137,26,0,-35.89166667,137.4333333,"","LLG","2","SA","","Kangaroo Island. Cape Gantheaume Conservation Park, Murray Lagoon","","","","","",24,7,2005,"","24/vii",49,"","n","No","","","","","","","16/12/15","GP","S","","","","","","","","",NA,49,"","",0
"7130",7915,17,35,36,0,138,36,0,-35.6,138.6,"","LLH","","SA","","Encounter Bay","","","","","",27,8,1927,"","",19,"N","N","1","","","","","","","25/2/02","GA","","H","","","J.B. Cleland","","AD 5691","","",NA,49,"","",NA
"20365",36968,66,37,36,0,145,38,30,-37.6,145.6416667,"","LLM","2","VIC","","Dom Dom saddle, east of Maroondah Hwy, along road to Carters Gap, about 200m from picnic ground","wide firebreak (low grass) with scattered Eucalyptus regnans, and adjacent E. regnans forest","","","","",19,5,2002,"","",16,"","","1","","","","","","","14/12/06","gl","S","","","FNCV excursion","","","","","",NA,9,"","",0
"7322",8213,58,35,27,58,138,27,8,-35.46611111,138.4522222,"385","LLG","","SA","","Fleurieu Peninsula: Sugar Loaf Hill","Eucalyptus obliqua woodland","Leaf litter","","","",19,7,2000,"","",17,"N","N","1","","","","","","","26/2/02","GA","S","","","","","","","","",1,49,"","",NA
"55901",1215724,172,38,23,18,145,33,42,-38.38833333,145.5616667,"","GOO","2","VIC","","The Gurdies Nature Conservation Reserve","Eucalypt forest with messmate","Ground","","","",1,9,2016,"","",18,"","","","","","","","","","24/2/17","GP","S","","","","","","","","",NA,329,"","",0
"57750",1218175,106,NA,NA,NA,NA,NA,NA,-41.6275,145.0761111,"38","LLG","1","TAS","","Mount Donaldson track from Savage River bridge.","Cool temperate rainforest, Nothofagus cunninghamii, open understorey with Dicksonia antarctica, sparse ground layer of ferns, fallen timber with dense growth of bryophytes.","On ground in deep leaf litter","","","",24,5,2016,"","",6,"","","","","","","","","","8/12/17","GP","S","","","Det: T Lebel","","","","","",NA,1570,"","",0
"16307",31892,69,37,54,18,146,17,33,-37.905,146.2925,"","LLG","2","VIC","","South Face Rd, 15 km from Thompson Valley Rd","Wet sclerophyll and rainforest gully. Eucalyptus regnans, Nothofagus,  Acacia dealbata, Dicksonia antarctica","","","","",18,5,2003,"","",2,"","","1","","","","","","","20/4/05","GL","S","","","Rawson foray site 22","","","","","",NA,874,"","",0
"34803",54643,28,37,42,1,140,47,1,-37.70027778,140.7836111,"34","LLG","2","SA","","14km north of Mount Gambier, off Riddoch Highway.","Eucalypt woodland.","On soil.","","","",3,6,2012,"","",36,"N","N","1","","","","","","","12/2/13","WC","S","","","","","","","","",NA,698,"","",0
"46289",1204055,82,38,25,20,144,57,33,-38.42222222,144.9591667,"","LLG","2","VIC","","Mornington Peninsula NP, Greens Bush, Baldry Crossing, Loop Walk, lower section","Heathy eucalypt forest with E.radiata, E. obliqua and E. viminalis","Ground near tree base","","","",22,6,2014,"","",142,"","","","","","","","","","17/7/15","GP","","","","","","","","","",NA,178,"","",0
"44257",1210744,96,36,11,1,150,4,5,-36.18361111,150.0680556,"","LLG","1","NSW","","Cowdroy Creek Forest","Warm Temperate Rainforest","dead wood","","","",12,4,2015,"","",63,"No","","","","","","","if required","","26/2/16","WC","S","","","","","","","","",NA,534,"","",0
"4980",6853,95,31,57,32,115,49,50,-31.95888889,115.8305556,"11","AMG","","WA","","Perth suburb, Shenton Park: Shenton Bushland, Lemnos Street","Tuart/Jarrah/Banksia woodland on sand","","","","",18,6,2000,"","HAR0562",1,"N","","","","","","","","","27/6/00","BA","S","","","","","","","","",1,562,"","",NA
"32974",51956,8,34,58,44,116,54,42,-34.97888889,116.9116667,"","LLG","1","WA","","Bow Bridge: Thomson Rd, off Vermeulen Rd","Tall closed forest of E. jacksonii, E. diversicolor","wood","","","",12,5,2007,"","",16,"","","2","","","","","","","30/5/12","GL","S","","","","","","","","",NA,78,"","",NA
"45086",1207768,38,30,33,0,138,35,0,-30.55,138.5833333,"565","LLG","3","SA","","WILPENA POUND","","","","","",27,7,2008,"","*27/vii.FT61",49,"","y","No","","","","","","","16/12/15","GP","S","","","","","","","","",NA,49,"","",0
"24750",41908,400,37,46,54,145,2,49,-37.78166667,145.0469444,"","MEL","2","VIC","","Melbourne suburb of Ivanhoe.  Wilson Reserve, about 3m from Yarra River.","Suburban conservation reserve with silver wattle, tree violet, currant bush.","Dead limb.","Acacia","dealbata","Silver wattle",3,6,2008,"","",103,"N","N","1","","","0","0","","","6/1/09","WC","S","","","Fungus reported here last year.","","","","","",NA,30,"","",0
"47822",1204857,81,NA,NA,NA,NA,NA,NA,-22.638093,117.460958,"","LLG","1","WA","","IBRA Region: Pilbara. 8 km north-northeast of Mount Turner, 33.7 km west-northwest of Tom Price and 16.6 km west of the intersection of Nanutarra Wittenoom Road and Nameless Valley Drive","North sloping footslope, Acacia aff. paraneura, A. xiphophylla low open woodland over Eremophila phyllopoda subsp. obliqua scattered shrubs over Senna stricta scattered low shrubs over Triodia sp. (epactia/pungens) scattered hummock grasses.","On soil.","","","",30,10,2011,"","",2,"N","","1","","","","","","","4/12/15","GP","S","","","","","","","","",NA,1301,"","",0
"17061",32409,6,34,27,40,116,20,20,-34.46111111,116.3388889,"","LLG","1","WA","","June Road, Sutton Forest Block","Burnt 25 year old Eucalyptus diversicolor regrowth forest","Soil","","","",24,6,2002,"","",1,"","","1","","","","","","","30/11/05","gl","S","","","Burnt Dec 1997; 1 fruit bodies, compiled by Verna Tunsell","","","","","",NA,720,"","",0
"53154",1212836,104,38,8,17,145,16,55,-38.13805556,145.2819444,"","LLG","2","VIC","","Royal Botanic Gardens Cranbourne, Stringybark Picnic area","","ground","","","",19,6,2016,"","",168,"Y","","1","","","","7","CBG4 Amanita farinacea byTorbjorn von Strokirch.jp","","1/7/16","GP","S","","","","","","","","",NA,178,"","",0
"9853",13991,58,37,32,22,145,20,59,-37.53944444,145.3497222,"500","AMG","2","VIC","","Kinglake NP: Jehosaphat Gully","tall Eucalyptus forest","","","","",2,5,1993,"","",4,"","","1","","","","","","","27/2/03","GE","S","","","","","","","","",3,9,"","",NA
"58929",1219453,16,37,49,2,145,51,46,-37.81722222,145.8627778,"","DES","2","VIC","","Yarra State Forest, Ada Tree Rainforest Walk","Rainforest Gully and Wet Sclerophyll Forest","","","","",22,4,2018,"","",183,"","","","","","","","","","18/7/18","GP","S","","","","","","","","",NA,178,"","",0
"47654",1209525,441,37,22,44,144,36,43,-37.37888889,144.6119444,"907","LLG","2","VIC","","Macedon Ranges NP, Sanatorium Lake, car park and Circuit Trail to lake","Wet messmate/gum forest and introduced species (pine, poplar, holly etc)","wood, tree roots","","","",24,5,2015,"","",151,"","","1","","","","","","","8/1/16","GP","S","","","","","","","","",NA,178,"","",0
"32497",51534,318,37,28,38,144,17,28,-37.47722222,144.2911111,"","LLG","1","VIC","","Blackwood, Simmon Reef Rd, Jack Cann Reserve.  Beside track into gully behind reserve.","Wet sclerophyll forest.","In leaf litter.","","","",17,5,2010,"","",18,"","","2","","","","","","","11/4/12","WCGL","S","","","","","","","","",NA,241,"","",0
"7189",8078,74,34,55,0,138,37,0,-34.91666667,138.6166667,"","LLH","","SA","","Adelaide Botanic Gardens: 50 yds past Simpson house","","One clump at base of Eucalyptus","Eucalyptus","","",14,5,1980,"","",20,"N","N","1","","","","","","","26/2/02","GA","","H","","no herb number","C. Watson","","AD","","",NA,49,"","",NA
"53521",1213288,609,35,13,0,138,42,0,-35.21666667,138.7,"","LLU","2","SA","","Kuitpo Forest from gate 95, off Harvey Road","","","","","",18,6,2016,"","",43,"","","1","","","","","","","29/7/16","GP","S","","","Sent by Pam Catcheside","","","","","",NA,698,"","",0
"59256",1219780,305,35,54,23,136,54,55,-35.90638889,136.9152778,"500","LLG","2","SA","","Cleland Conservation Park, Long Gully Track","Tall open woodland with areas of messmate (Eucalyptus obliqua) and Manna Gum (Eucalyptus viminalis ssp. viminalis). Understorey of Acacia pycnantha, A. retinoides, Leptospermum continentale. Area burnt 2010.","","","","",15,7,2018,"","",49,"","","","","","","","","","29/8/18","GP","S","","","Leader: Julia Haska","","","","","",NA,698,"","",0
"23987",41096,263,37,46,13,145,45,23,-37.77027778,145.7563889,"220","1","2","VIC","","Warburton. Big Pats Creek 'Walk into History' track","","Dead wood","","","",4,9,2005,"","",53,"N","N","1","","","","","","","1/10/08","GP","S","","","","","","","","",NA,178,"","",0
"47498",1205742,757,35,2,0,138,42,0,-35.03333333,138.7,"","LLG","2","SA","","Loftia Recreation Park, about 3 km south-west of Stirling","","","","","",20,7,2002,"","20/vii",49,"N","N","No","","","","","","","4/12/15","GP","S","","","","","","","","",NA,49,"","",0
"53903",1213783,2365,38,27,23,143,37,2,-38.45638889,143.6172222,"","LLG","2","VIC","","Otway Forest Park, about 3 km south of Barongarook","Mixed species","On ground after fire","","","",7,7,2013,"","",7,"Y","","2","TM","12/8/16","","7","Hebeloma aminophilum2","","19/8/16","GP","S","","","Photos backed up on CD 95","","","","","",NA,1377,"","",0
"2645",3668,77,35,51,0,136,42,0,-35.85,136.7,"","LLH","","SA","","Kangaroo Island","","","","","",31,3,1929,"","BEL0278",1,"N","","1","","","","","","","16/4/99","PG","","H","","","J.B. Cleland","","AD 1636-1641, 1643-4, 1648","","",NA,278,"","",NA
"50086",1208579,1368,35,36,0,138,14,28,-35.6,138.2411111,"","DES","2","SA","","Fleurieu Peninsula. Deep Creek Conservation Park. Stringybark Trail","","","","","",6,7,2013,"","6/vii",49,"","n","No","","","","","","","30/12/15","GP","S","","","","","","","","",NA,49,"","",0
"48627",1205601,701,30,33,0,138,35,0,-30.55,138.5833333,"565","LLG","3","SA","","WILPENA POUND","","","","","",3,6,2001,"","3/vi",49,"N","n","No","","","","","","","4/12/15","GP","S","","","","","","","","",NA,49,"","",0
"11723",16969,73,37,32,53,144,33,18,-37.54805556,144.555,"","LLG","1","VIC","","Bullengarook: track from south gate to Pyrete State Forest, Hobbs Rd","Stringybark forest: Eucalyptus obliqua, Eucalyptus baxteri","In mossy area","","","",26,7,2003,"","",11,"N","N","1","","","","","","","11/12/03","GP","S","","","","","","","","",NA,19,"","",NA
"13282",24670,356,37,41,0,145,31,30,-37.68333333,145.525,"","","","VIC","","Near Picaninny Swamp, Coranderrk Bushland Reserve, c. 3 miles S of Healesville.","","","","","",15,5,1973,"","",1,"","","1","","","","","","","21/4/04","CFR","","H","","","Willis, J.H.","","MEL 2014902","","",5,903,"","",NA
"19443",35842,54,37,40,23,145,52,59,-37.67305556,145.8830556,"","LLG","2","VIC","","Warburton, Upper Yarra Reservoir Park, Doctor Creek walk.","Eucalypt forest and some planted natives.","Litter","","","",1,8,2004,"","",19,"N","N","1","","","","","","","8/8/06","WC","S","","","","","","","","",NA,178,"","",0
"37837",56879,1107,37,28,45,144,17,24,-37.47916667,144.29,"","LLG","2","VIC","","Blackwood, Jack Cann Reserve, Simmons Reef Road. Picnic ground and Lerderderg River Walk","Picnic area with pine trees. River Heritage walk in eucalypt open forest with Eucalyptus radiata, E. viminalis, E. obliqua, various wattles including Acacia melanoxylon, banksias and peas.","Algae","","","",7,7,2013,"","",129,"N","N","1","","","","","","","8/11/13","GP","S","","","","","","","","",NA,178,"","",0
"30122",49030,9,38,32,0,145,53,0,-38.53333333,145.8833333,"","DES","3","VIC","","Leongatha South.","A shaded bush nursery.","On chip mulch.","","","",0,0,0,"1960s, 70s, 80s","",1,"N","N","1","","","0","0","","","8/3/11","WC","S","","","Comes up in colonies.","","","","","",NA,236,"","",0
"60516",1221078,1038,31,52,18,115,54,25,-31.87166667,115.9069444,"","LLG","1","WA","","Lightning Swamp Bushland, Noranda","Flooded Gum seasonal wetland","Growing in soil.","","","",23,8,2009,"","",1,"","","","","","","","","","13/3/19","GP","S","","","","","","","","",NA,1162,"","",0
"19175",36335,32,37,29,0,144,17,0,-37.48333333,144.2833333,"","","2","VIC","","Wombat State Forest; Lerderderg Heritage River Walk","Dry box & stringybark woodland","soil, leaf litter","","","",24,5,2003,"","",30,"","","2","TM","3/12/04","","4","032pg11","","23/11/06","gl","S","","","image number EDSCN1596  Photo stored on CD38.","","","","","",NA,707,"","",0
"46479",1208323,556,37,9,30,140,37,0,-37.15833333,140.6166667,"","LLG","2","SA","","Mary Seymour Conservation Park, about 25 km south of Naracoorte","","","","","",12,7,2010,"","12/vii",49,"","n","No","","","","","","","30/12/15","GP","S","","","","","","","","",NA,49,"","",0
"49155",1206310,762,35,22,0,138,32,0,-35.36666667,138.5333333,"","LLG","2","SA","","Fleurieu Peninsula, Glenshera Swamp","","","","","",12,6,2004,"","*12/vi",49,"N","y","No","","","","","","","4/12/15","GP","S","","","","","","","","",NA,49,"","",0
