"","id","Sp_no","LAT","LA2","LA3","LONG","LO2","LO3","LATDEC","LONGDET","ALT","SGRIDS","PRCODE","STATE","VGR","LOCALITY","HABITAT","SUBSTRATE","HOSTgenus","HOSTsp","HOSTcname","DAY","MONTH","YEAR","date.comments","oldID","BATCH","PHOTO","SPECIMEN","Checked","Initial","date.checked","Basis...specimen","Basis...photo","PhotoID","Submitted.as","date.entered","DENTRY","SS","SH","SL","COMMENTS","COLL.NO","DET","HERB.NO","LITauth","LITbibl","AHC","recorded_by","Doubtful.record","Book.or.REF","REF.Number"
"22591",39571,369,37,59,6,145,35,41,-37.985,145.5947222,"","LLG","2","VIC","","Bunyip State Forest. Mortimer Picnic Ground and nature trail","Wet sclerophyll forest - Mountain grey gum - Eucalyptus cypellocarpa","wood","","","",20,6,2004,"","",34,"N","N","1","","","","","","","26/11/07","GP","S","","","","","","","","",NA,178,"","",0
"15079",29786,274,33,43,0,151,15,0,-33.71666667,151.25,"","LLM","2","NSW","","Narrabeen Lake East Park. Wheeler Creek","","","","","",12,5,2001,"","",12,"","","1","","","","","","","10/2/05","GP","S","","","","","","","","",7,297,"","",NA
"58236",1218645,2459,29,50,49,152,56,47,-29.84694444,152.9463889,"","GOO","2","NSW","","Braunstone, 519 Mulquinneys Road.","","On dead bark and/or leaf matter.","","","",13,6,2017,"","",16,"","","3","TM","22/9/17","","7","13_06_2017_IMG_ 7509 copy, 13_06_2017_IMG_7514 cop","Unidentifiable","23/2/18","WC","S","","","25 mm tall x 3 mm across including below the ground. 12 mm above ground. Grouped. Top is hollow and porous under the outside skin surface is granular looking stem is striated and occasional folding of top and stem.","","","","","",NA,1454,"","",0
"58098",1218502,752,38,8,12,145,16,56,-38.13666667,145.2822222,"","MEL","2","VIC","","Cranbourne RBG, Stringybark Picnic Area","Remnant bushland","Wood","","","",25,6,2017,"","",36,"","","","","","","","","","12/1/18","GP","S","","","","","","","","",NA,760,"","",0
"5337",5679,66,37,29,44,145,14,48,-37.49555556,145.2466667,"","AMG","","VIC","","Kinglake NP: Masons Falls track to lookout","wet sclerophyll","on log","","","",8,5,1999,"","FNC0178",6,"N","","1","","","","","","","21/5/99","PG","S","","","FNCV botany excursion, led by Bruce Fuhrer. 1 fruiting cap.","","","","","",2,178,"","",NA
"32142",51164,59,37,48,47,144,58,57,-37.81305556,144.9825,"","MEL","2","VIC","","East Melbourne, north-east part of Fitzroy Gardens.","","On short turf.","","","",13,11,2011,"","",177,"N","N","1","","","","","","","27/1/12","WC","S","","","Three or four rather old basidiomes.","","","","","",NA,211,"","",0
"22836",42001,115,37,35,0,145,38,0,-37.58333333,145.6333333,"","LLU","2","VIC","","Narbethong. Dom Dom Saddle","Eucalypt forest with mountain ash, treeferns and a grassy clearing","Soil","","","",5,8,2007,"","",62,"N","N","1","","","","","","","21/1/09","GP","S","","","","","","","","",NA,178,"","",0
"48951",1206071,1979,32,49,30,138,3,0,-32.825,138.05,"161","LLG","2","SA","","Mount Remarkable NP Mambray Creek ","","","","","",6,8,2003,"","*6/viii",49,"N","y","No","","","","","","","4/12/15","GP","S","","","","","","","","",NA,49,"","",0
"30335",49238,899,34,22,56,116,1,16,-34.38222222,116.0211111,"","LLG","2","WA","","Manjimup, off Tramway Trail, Big Karri.","Forest - Karri (Eucalyptus diversicolor).","Litter.","","","",4,6,2009,"","",11,"N","N","1","","","","","","","15/3/11","WC","S","","","Buff umbrellas K.Syme.","","","","","",NA,174,"","",0
"8600",14108,96,34,1,53,115,59,2,-34.03138889,115.9838889,"","LLG","2","WA","","Bridgetown: Jarrah Park","Eucalyptus marginata, E. calophylla over Bossaiea aquifolium","","","","",1,6,2002,"","",10,"","","1","","","","","","","3/3/03","GE","S","","","with Western Australian Naturalists' Club","","","","","",2,78,"","",NA
"18582",34987,74,38,22,17,144,55,8,-38.37138889,144.9188889,"25","MEL","2","VIC","","Rosebud Park and Recreation Reserve, Plantation Reserve, Rosebud Avenue.","","Acid sands.  Seemingly on soil, but abutting dead eucalypts.","Eucalyptus","","",5,6,2005,"","",2,"N","N","1","","","","","","","7/2/06","WC","S","","","Also seen 23/6/2005.","","","","","",NA,828,"","",0
"22363",40517,555,37,43,0,145,14,0,-37.71666667,145.2333333,"","DES","2","VIC","","Warrandyte State Park, Jumping Creek Reserve. Nature trail","Dry forest. Eucalyptus (mainly E. polyanthemos), Kunzea","soil","","","",29,8,2004,"","",43,"N","N","1","","","","","","","6/8/08","GP","S","","","","","","","","",NA,178,"","",0
"26814",44374,58,41,50,26,146,9,50,-41.84055556,146.1638889,"596","LLG","1","TAS","","Mole Creek.  Lees Paddock Track.","Rainforest","Leaf litter","","","",8,4,2009,"","",15,"N","N","2","","","0","1","058rs02","","2/3/10","WC","S","","","","","","","","",NA,933,"","",0
"39295",61522,507,38,23,58,144,11,12,-38.39944444,144.1866667,"","LLG","1","VIC","","Coogoorah Park, Anglesea","Swamp gum forest. Other spp: Eucalyptus ovata, Leptospermum continentale, Ozothamnus ferrugineus, Pteridium esculentum, Poa labillardierei","Wood","","","",24,6,2011,"","",1,"Y","","2","TM","1/12/13","","4","","","24/1/14","GP","S","","","Photo on CD 82","","","","","",NA,1573,"","",NA
"39606",61749,170,37,58,1,140,52,33,-37.96694444,140.8758333,"25","LLG","1","SA","","Butterfly Walk, Penambol Conservation Park near Mount Gambier","Limestone soil, eucalypt/Banksia marginata open woodland","in soil","","","",4,6,2011,"","",48,"","N","","","","","","","","11/2/14","WC","","","","","","","","","",NA,49,"","",NA
"36993",57190,70,32,2,21,115,50,49,-32.03916667,115.8469444,"10","LLG","1","WA","","Bluegum Lake, Melville","native vegetation","On fallen dead wood","Jacksonia","furcellata","",29,5,2012,"","",13,"","","1","","","","","","","3/1/14","GP","S","","","","","","","","",NA,217,"","",NA
"60219",1220734,128,NA,NA,NA,NA,NA,NA,-37.5419,145.4767,"","LLU","2","VIC","","About 2.5 km south-west of Castella, on Melba Highway","","","","","",0,0,0,"Before 21/1/2006","",9,"Y","","2","GP","9/11/18","","7","Lactarius eucalypti","","16/1/19","GP","S","","","On CD 115","","","","","",NA,1377,"","",0
"21793",39879,15,36,34,22,143,51,39,-36.57277778,143.8608333,"150","AMG","2","VIC","","Inglewood, Nixon St.  Mining reserve, 500m from Calder Highway.","Eucalyptus largiflorens.","","","","",17,5,2007,"","",2,"N","N","1","","","0","0","","","15/4/08","WC","S","","","","","","","","",NA,960,"","",0
"37416",56500,982,38,25,20,144,57,33,-38.42222222,144.9591667,"","LLG","2","VIC","","Mornington Peninsula NP, Greens Bush, Baldry Crossing, Creek walk","Heathy eucalypt forest","Litter","","","",2,6,2013,"","",125,"N","N","1","","","","","","","11/10/13","","S","","","","","","","","",NA,178,"","",0
"32073",51265,90,35,1,5,138,39,28,-35.01805556,138.6577778,"330","LLG","2","SA","","Belair National Park, Long Gully.","Stringybark woodland.","Wood","Eucalyptus","obliqua","Stringybark",17,5,2008,"","",29,"","","2","","","","","","","15/2/12","WC","S","","","","","","","","",NA,698,"","",0
"26502",44356,74,37,11,4,142,52,12,-37.18444444,142.87,"","AMG","2","VIC","","Great Western.  Off Garden Gully Rd, Westgate Reserve.","Eucalypt woodland, probably box species.","At base of dead eucalypt.","","","",23,7,2009,"","",9,"N","N","2","TM","5/8/09","","4","074jnh01, 074jnh02","","16/2/10","WC","S","","","","","","","","",NA,1280,"","",0
"38701",60625,1297,41,37,38,145,4,45,-41.62722222,145.0791667,"","","","TAS","","Savage River Bridge, south east side of crossing","Nothofagus cunninghamii rainforest, Acradenia franklinii, mossy ground cover.","","","","",24,4,2006,"","FM-TARK2006-1056",4,"","","","","","","","","","13/1/14","","","","","formosa","","","","","",NA,1570,"","",NA
"12431",24636,334,24,16,0,131,36,0,-24.26666667,131.6,"","","","NT","","George Gill Range, Reegy Rock Hole.","Terrestrial.","","","","",4,7,1967,"","",1,"","","1","","","","","","","21/4/04","CFR","","H","","","Beauglehole, A.C.","Beaton, G.W.","MEL 264686","","",5,903,"","",NA
"44650",1208503,746,37,41,53,140,47,9,-37.69805556,140.7858333,"","DES","2","SA","","Telford Scrub Conservation Park, about 15 km north of Mount Gambier","","","","","",5,6,2011,"","5/vi",49,"","n","No","","","","","","","30/12/15","GP","S","","","","","","","","",NA,49,"","",0
"10411",14474,75,37,37,59,143,52,34,-37.63305556,143.8761111,"","AMG","","VIC","","Mount Helen","under pine tree","pine needles","","","",0,6,2001,"","",2,"N","N","1","","","","","","","10/4/03","GL","S","","","Several clumps.  Often dug up by something.","","","","","",3,307,"","",NA
"55213",1215159,763,36,3,36,150,7,49,-36.06,150.1302778,"50","DES","2","NSW","","Tuross Head, Chatham Park, Plot 1","Littoral rainforest with Eucalyptus pilularis (blackbutt) and Pittosporum undulatum","Log","","","",30,4,2002,"","",10,"","","","","","","","","","30/12/16","GP","S","","","Chatham Park Fungal Survey with Noreen and Ray Baxter","","","","","",NA,28,"","",0
"33921",52941,434,37,28,39,144,17,28,-37.4775,144.2911111,"","LLG","2","VIC","","Blackwood. Jack Cann Reserve, Lerderderg River walk from Garden of St Erth carpark","Eucalypt open forest with Narrow-leaved peppermint (E. radiata), Manna gum (E. viminalis) and Messmate stringybark (E. obliqua) and understorey of various wattles including Blackwood (Acacia melanoxylon), banksias and peas.","Litter, leaves and small twigs","","","",19,6,2011,"","",102,"N","N","1","","","","","","","16/8/12","GP","S","","","","","","","","",NA,178,"","",0
"17697",33732,6,34,57,51,117,21,21,-34.96416667,117.3558333,"","LLG","1","WA","","Strickland St bushland, Denmark town, track to Inlet Drive","Tall forest dominated by E.diversicolor. E. calophylla.  Burnt Feb 2000","","","","",24,6,2001,"","",2,"","","1","","","","","","","22/12/05","gl","S","","","Denmark conf site 1","","","","","",NA,875,"","",0
"55331",1215885,1107,30,29,46,152,24,24,-30.49611111,152.4066667,"","DES","1","NSW","","New England NP. Lower Lyrebird Walk","","","","","",22,5,2007,"","",16,"Y","","","","","","7","NF8011 D. arcuata @ lower Lyrebird Walk 5-07","","5/5/17","GP","S","","","","","","","","",NA,524,"","",0
"5332",5674,66,37,43,13,145,37,5,-37.72027778,145.6180556,"","AMG","","VIC","","Healesville: Ben Cairn Track, off Cairn Road","Wet sclerophyll: Mountain Ash (Eucalyptus regnans), Silver Wattle (Acacia dealbata)","on wet log","","","",1,4,1999,"","GRE0048",8,"N","","1","","","","","","","24/4/99","","S","","","","","","","","",2,48,"","",NA
"6283",6665,74,37,42,58,145,17,12,-37.71611111,145.2866667,"","DES","2","VIC","","Wonga Park: Homestead Reserve, near Yarra River","Among tea tree on hillside","On dead wood","","","",10,6,1998,"","WAT0250",1,"N","","1","","","","","","","19/6/98","PG","S","","","3 clusters, 1m apart; observed luminescence in dark","","","","","",1,250,"","",NA
"43615",120344,223,38,20,0,144,44,0,-38.33333333,144.7333333,"","DES","2","VIC","","Sorrento - old tip","","grass","","","",16,6,1970,"","",1,"","","1","","","","","","","1/5/15","GP","S","","","CSIRO Division of Forest Products Fungi Herbarium accession number #15380 (specimen not present or not retained when moved to MEL in 2000). Data from accession book held at RBG Melbourne.","Walters, N.E.M.","Walters, N.E.M.","","","",NA,1586,"","",0
"27961",45633,92,36,16,32,149,36,50,-36.27555556,149.6138889,"","LLG","1","NSW","","Wadbilliga River Crossing National Park.","Acacia and eucalypt grove.","Dead branch","","","",9,8,2009,"","",37,"N","N","1","","","","","","","1/6/10","WC","S","","","","","","","","",NA,534,"","",0
"48419",1205393,1939,30,33,0,138,35,0,-30.55,138.5833333,"565","LLG","3","SA","","WILPENA POUND","","","","","",19,6,2000,"","19/vi",49,"N","n","No","","","","","","","4/12/15","GP","S","","","","","","","","",NA,49,"","",0
"57753",1218178,10,NA,NA,NA,NA,NA,NA,-41.62694444,145.0775,"40","LLG","2","TAS","","Mount Donaldson track from Savage River bridge.","Cool temperate rainforest, Nothofagus cunninghamii, open understorey with Dicksonia antarctica, sparse ground layer of ferns, fallen timber with dense growth of bryophytes.","Trunk of small tree","","","",24,5,2016,"","",6,"","","","","","","","","","8/12/17","GP","S","","","Det: T Lebel","","","","","",NA,1570,"","",0
"42642",120117,94,37,48,28,144,8,49,-37.80777778,144.1469444,"","LLM","2","VIC","","7.5km north-east of Meredith, Whinray Road, at Eclipse Creek bridge.","Creek bank dominated by grass and silver wattles.","On fallen gum tree trunk.","Eucalyptus","","",2,6,2014,"","",28,"N","N","1","","","0","","","","24/3/15","WC","S","","","","","","","","",NA,241,"","",0
"55232",1215178,318,36,3,41,150,7,49,-36.06138889,150.1302778,"30","DES","2","NSW","","Tuross Head, Chatham Park, Plot 2","Littoral rainforest with Eucalyptus botryoides, Pittosporum undulatum, Backhousia myrtifolia and Allocasuarina littoralis","","","","",20,3,2002,"","",10,"","","","","","","","","","30/12/16","GP","S","","","Chatham Park Fungal Survey with Noreen and Ray Baxter","","","","","",NA,28,"","",0
"40997",63848,544,37,59,6,145,35,41,-37.985,145.5947222,"","LLG","2","VIC","","Bunyip State Forest, Mortimer Reserve nature trail","Riparian forest","bark, eucalypt","","","",27,4,2014,"","",133,"","","1","","","","","","","8/8/14","GP","S","","","","","","","","",NA,178,"","",NA
"57443",1217935,316,NA,NA,NA,NA,NA,NA,-41.683044,146.782043,"400","LLG","2","TAS","","Liffey Falls Reserve - Parks & Wildlife Walking track","Rainforest, Nothofagus cunninghamii ","","","","",18,5,2016,"","",6,"","","","","","","","","","8/12/17","GP","S","","","Det: Tom May","","","","","",NA,1570,"","",0
"34374",53232,322,37,56,5,145,35,5,-37.93472222,145.5847222,"346","LLG","2","VIC","","Gembrook. Whites Corner","EVC Lowland Forest 16: Messmate, Narrow-leaf peppermint, 3 weeks after fire.","Burnt ground","","","",22,4,2012,"","",105,"N","N","1","","","","","","","20/9/12","GP","S","","","","","","","","",NA,178,"","",0
"52918",1212698,296,37,35,35,145,38,24,-37.59305556,145.64,"","LLG","2","VIC","","Dom Dom Saddle, Upper Yarra Ranges. Car park and picnic ground","Eucalypt forest (including Mountain Ash), tree ferns, grassy clearing. Part of the area was burnt in 2009 bushfires so there is a verdant understorey","ground","","","",12,6,2016,"","",167,"Y","","1","","","","7","DD1 Laccaria sp. D by Sue Forster","","1/7/16","GP","S","","","","","","","","",NA,178,"","",0
"5101",5215,12,35,53,24,148,26,54,-35.89,148.4483333,"1470","LLG","1","NSW","","Kosciusko NP: Three Mile Dam, near Kiandra","Sub-alpine, open grassed area, 4 m from dam water","","","","",14,1,1999,"","SMI0065",10,"N","","1","","","","","","","16/3/99","","S","","","","","","","","",1,65,"","",NA
"48978",1206098,1848,35,9,30,139,7,30,-35.15833333,139.125,"150","LLG","2","SA","","Murray Region. Monarto Conservation Park, about 15 km west of Murray Bridge","","","","","",20,9,2003,"","20/ix",49,"N","n","No","","","","","","","4/12/15","GP","S","","","","","","","","",NA,49,"","",0
"10458",14532,37,43,5,0,147,11,0,-43.08333333,147.1833333,"220","LLM","2","TAS","","Snug Falls State Recreation Area: Snug Falls walking track","Open forest with Eucalyptus obliqua dominant with a heathy understorey","in soil","","","",25,4,2003,"","",8,"N","N","1","","","","","","","28/4/03","GE","S","","","","","","","","",3,174,"","",NA
"15611",30020,188,34,39,24,150,18,13,-34.65666667,150.3036111,"680","AMG","1","NSW","","Bundanoon Art Gallery grounds","open garden","pinebark mulch","","","",3,7,1997,"","",13,"N","N","1","","","","","","","17/2/05","GL","S","","","","","","","","",NA,46,"","",0
"35818",54741,77,35,36,3,138,14,33,-35.60083333,138.2425,"269","AMG","2","SA","","13km east of Cape Jervis, Deep Creek Conservation Park.","Eucalypt woodland.","On eucalypt trunk.","","","eucalypt",4,8,2012,"","",36,"N","N","1","","","","","","","19/2/13","WC","S","","","","","","","","",NA,698,"","",0
"23798",41319,316,37,46,54,145,2,32,-37.78166667,145.0422222,"","MEL","2","VIC","","Melbourne suburb of Ivanhoe.  Bank of the Yarra River.","","","","","",4,6,2008,"","",100,"N","N","2","TM","2/6/08","0","4","316rb01","","21/10/08","WC","S","","","","","","","","",NA,30,"","",0
"34810",54650,68,37,42,1,140,47,1,-37.70027778,140.7836111,"34","LLG","2","SA","","14km north of Mount Gambier, off Riddoch Highway.","Eucalypt woodland.","On wood.","","","",3,6,2012,"","",36,"N","N","1","","","","","","","12/2/13","WC","S","","","","","","","","",NA,698,"","",0
"51551",1211870,400,NA,NA,NA,NA,NA,NA,-37.878,145.3581,"","GOO","2","VIC","","Sherbrooke","wet forest","log","","","",29,4,2006,"","",15,"Y","","2","GP","9/4/16","","7","PICT9356","","18/5/16","GP","S","","","","","","","","",NA,1346,"","",0
"34199",54152,774,34,59,25,138,42,40,-34.99027778,138.7111111,"","DES","2","SA","","Mount Lofty Botanic Garden.","","","","","",8,5,2010,"","",34,"","","1","","","","","","","4/1/13","WC","S","","","","","","","","",NA,698,"","",NA
"6553",7444,75,37,2,24,142,57,43,-37.04,142.9619444,"","LLG","1","VIC","","Stawell; Joel Bushland Reserve; off Stawell-Landsborough Road","Yellow Gum & Grey Box","","","","",22,7,2001,"","",25,"N","N","1","","","","","","","17/12/01","GA","S","","","","","","","","",1,104,"","",NA
"40747",63581,129,29,50,45,156,56,47,-29.84583333,156.9463889,"30","LLU","2","NSW","","Braunstone, 519 Mulquineys Road.","Creek line in mostly casuarina vegetation.","On rotted wood.","","","",18,2,2013,"","",6,"N","N","3","TM","14/2/14","0","7","129fd01","153","1/4/14","WC","S","","","","","","","","",NA,1454,"","",0
"55521",1216071,7,37,40,49,145,44,19,-37.68027778,145.7386111,"","DES","2","VIC","","Acheron Gap","","","","","",0,4,2004,"","",16,"Y","","","","","","7","VM7650 Amauroderma rude @ Acheron Gap 4-04","","5/5/17","GP","S","","","","","","","","",NA,524,"","",0
"58631",1220813,115,31,52,12,115,54,21,-31.87,115.9058333,"","LLG","1","WA","","Lightning Swamp Bushland, Noranda","Banksia, Jarrah, Marri & Melaleuca preissiana woodland with Melaleuca preissiana woodland on northern edge  ","","","","",12,6,2010,"","",1,"Y","","2","GP","20/2/19","","7","P6124801© K. J. Tullis.jpg","","13/3/19","GP","S","","","Gills close. Note spore print on two caps that were beneath the inverted one. Note cortina on button, and its brighter colour. Some older caps depressed in centre – gills broadly convex near stipe then flatten out abruptly where the lamellulae begin.  Sti","","","","","",NA,1162,"","",0
"16552",31829,68,37,29,50,145,14,43,-37.49722222,145.2452778,"440","LLG","2","VIC","","Kinglake NP, Lyrebird Circuit","wet forest - ferngully, Mt Ash/Stringybark","fallen log","","","",16,5,2004,"","",15,"","","1","","","","","","","20/4/05","GL","S","","","FNCV Foray; still fairly dry","","","","","",NA,48,"","",0
"10923",15071,17,38,16,39,144,36,55,-38.2775,144.6152778,"","MEL","2","VIC","","Pt Lonsdale, Royal Park Caravan Park south end","mown grass","mown Kikuyu","","","",25,5,2003,"","",11,"N","N","1","","","","","","","10/7/03","GL","S","","","14 caps","","","","","",NA,143,"","",NA
"47489",1205733,6,35,47,0,137,51,0,-35.78333333,137.85,"","LLG","2","SA","","Kangaroo Island, Dudley Conservation Park","","","","","",7,8,2002,"","7/viii",49,"N","N","No","","","","","","","4/12/15","GP","S","","","","","","","","",NA,49,"","",0
"31077",49887,75,37,50,26,145,7,5,-37.84055556,145.1180556,"","MEL","2","VIC","","Burwood, Gardiners Creek Reserve.","Park","Soil","","","",5,5,2011,"","",17,"N","N","1","","","0","0","","","19/7/11","WC","S","","","","","","","","",NA,760,"","",0
"28752",47801,7,26,24,0,153,1,0,-26.4,153.0166667,"25","LLU","2","QLD","","Tewantin, Heritage Park.","","Soil","","","",28,7,2007,"","",1,"N","N","1","","","0","0","","","14/9/10","WC","S","","","","","","","","",NA,1153,"","",0
"10003",14198,59,37,45,35,145,12,23,-37.75972222,145.2063889,"","MEL","2","VIC","","Warrandyte: Beauty Gully Road","wet grassy paddock","grass","","","",24,4,2002,"","",11,"N","N","1","","","","","","","3/3/03","GE","S","","","very numerous, large troupes","","","","","",2,25,"","",NA
"16381",32736,58,34,7,17,116,3,26,-34.12138889,116.0572222,"","LLG","1","WA","","Wagelup Road, Thornton Forest Block","Eucalyptus marginata/Corymbia calophylla forest","Soil","","","",18,6,2003,"","",1,"","","1","","","","","","","30/11/05","gl","S","","","1 fruit bodies, compiled by Verna Tunsell","","","","","",NA,720,"","",0
"13650",27752,54,37,39,0,145,51,0,-37.65,145.85,"","LLG","2","VIC","","Reefton, Fisherman Drive.","Under messmate - peppermint gums","Soil, leaf litter.","","","",27,6,2003,"","",10,"N","N","2","TM","23/6/04","","1","","","10/8/04","RS","S","","","Photo stored with record.","","","","","",NA,820,"","",NA
"11010",15177,59,37,3,1,142,47,31,-37.05027778,142.7919444,"","LLG","1","VIC","","Stawell, Crowlands Rd","grass","","","","",21,5,2003,"","",42,"N","N","1","","","0","0","","","18/12/03","GP","S","","","","","","","","",NA,104,"","",NA
"34088",53365,147,34,59,17,118,11,38,-34.98805556,118.1938889,"183","LLM","2","WA","","Albany, Two Peoples Bay Nature Reserve, Firebreak Valley Track","Corymbia calophylla, Melaleuca sp. ","wood","","","",25,6,1991,"","",18,"","","2","","","","","","","27/9/12","GL","S","","","","","","","","",NA,78,"","",NA
"6158",7749,46,35,11,36,138,40,22,-35.19333333,138.6727778,"","LLU","","SA","","McLaren Vale, E: Kuitpo Pine Forest, Wicks / Wickham Rds junction.","Sunny, dry day.  No rain for about a weeks.  Very few A muscarias, Gymnopilus pampeanus, Mycena.  Lots of brown and fawn umbonates.  Spanish broom starting to grow.","On pine.","Pinus","radiata","Pine",28,6,1997,"","",4,"N","N","1","","","","","","","20/2/02","GA","S","","","Very few specimens.","","","","","",1,49,"","",NA
"32204",51477,382,36,9,38,150,4,47,-36.16055556,150.0797222,"","LLG","2","NSW","","5km west of Dalmeny, Box Cutting Rainforest.","Remnant rainforest.","In a dead wood hollow.","","","",4,4,2010,"","",41,"","","2","","","","","","","11/4/12","WC","S","","","","","","","","",NA,534,"","",0
"19196",35861,90,33,49,30,151,8,0,-33.825,151.1333333,"","LLU","2","NSW","","Sydney North, Hunters Hill, Boronia Park, Lane Cove River area.","","","","","",19,3,2005,"","",20,"N","N","1","","","","","","","29/8/06","WC","S","","","","","","","","",NA,297,"","",0
"40203",62524,1353,28,50,48,151,58,32,-28.84666667,151.9755556,"1000","","3","QLD","","Underground Creek, Girrawean NP","Dry sclerophyll forest","Soil","","","",16,4,2011,"","",2,"","","1","","","","","","","12/3/14","GP","S","","","","","","","","",NA,1287,"","",NA
"51713",1211511,170,26,40,52,152,55,24,-26.68111111,152.9233333,"","LLG","1","QLD","","Sunshine Coast Hinterland, 270 Hunchy Road","Cleared forest","logs 50-80 cm diam","","","",3,10,2006,"","",26,"","","1","","","","","PycnCocSep06_1-7","","29/4/16","GP","S","","","","","","","","",NA,174,"","",0
"40588",63245,93,26,54,0,151,38,0,-26.9,151.6333333,"","","3","QLD","","Munro's Camp Track, Bunya Mountains","","log","","","",17,3,2012,"","",2,"","","1","","","","","","","12/3/14","GP","S","","","","","","","","",NA,1287,"","",NA
"15031",28994,369,41,28,33,145,27,39,-41.47583333,145.4608333,"600","LLG","2","TAS","","Philosopher Falls, Waratah","rainforest dominated by Nothofagus and sassafras","rotting log","","","",8,3,2004,"","",16,"","","1","","","","","","","4/11/04","GP","S","","","","","","","","",6,640,"","",NA
"24415",41798,94,28,13,16,153,16,31,-28.22111111,153.2752778,"","LLM","3","QLD","","Springbrook NP - Warrie circuit","Rainforest","","","","",31,5,2007,"","",11,"","","1","","","","","","","12/12/08","GL","S","","","","","","","","",NA,524,"","",0
"24124",41286,441,37,55,47,145,27,34,-37.92972222,145.4594444,"","1","2","VIC","","Emerald Lake Park","Previously a nursery. Tree and bracken ferns common","Log","","","",13,5,2007,"","",56,"N","N","1","","","","","","","15/10/08","GP","S","","","","","","","","",NA,178,"","",0
"44003",120862,2216,37,47,0,145,9,0,-37.78333333,145.15,"","DES","2","VIC","","Doncaster East","","grass, bushes, etc","","","",28,5,1972,"","",1,"","","1","","","","","","","1/5/15","GP","S","","","CSIRO Division of Forest Products Fungi Herbarium accession number #14583 (specimen not present or not retained when moved to MEL in 2000). Data from accession book held at RBG Melbourne.","Walters, N.E.M.","Walters, N.E.M.","","","",NA,1586,"","",0
"35732",55310,415,36,34,30,143,51,40,-36.575,143.8611111,"162","LLG","1","VIC","","Inglewood, Potters Hill Road, DSE block.","Eucalyptus polybractea","On dead tree stump of Eucalyptus polybractea.","Eucalyptus","polybractea","",10,7,2004,"","",3,"N","N","1","","","0","","","","30/4/13","WC","S","","","","","","","","",NA,960,"","",0
"56738",1217355,557,37,31,6,146,2,39,-37.51833333,146.0441667,"","LLG","2","VIC","","Near Noojee. Toorongo Falls and Amphitheatre Falls Loop Walk","","wood","","","",16,7,2017,"","",181,"","","","","","","","","","11/8/17","GP","S","","","","","","","","",NA,178,"","",0
"34709",54273,79,38,41,51,143,22,10,-38.6975,143.3694444,"","","2","Vic","","Greater Otway National Park, Melba Gully.","Cool temperate rainforest dominated by Nothofagus cunninghamii.","Fallen rotten branch.","","","",30,4,2011,"","",93,"","","1","","","","","","","4/1/13","WC","S","","","A group seen on a small branch.","","","","","",NA,178,"","",NA
"17250",32420,6,34,28,35,115,51,20,-34.47638889,115.8555556,"","LLG","1","WA","","Tank Road, Flybrook Forest Block","Burnt 25 year old Eucalyptus diversicolor regrowth forest","Soil","","","",1,7,1998,"","",1,"","","1","","","","","","","30/11/05","gl","S","","","Burnt Dec 1997; 2 fruit bodies, compiled by Verna Tunsell","","","","","",NA,720,"","",0
"54314",1214124,2384,37,49,48,144,54,0,-37.83,144.9,"","LLU","2","VIC","","Westgate Park, Todd Rd. Fishermans Bend","","","","","",9,7,2016,"","",4,"Y","","2","TM","7/9/16","","7","Parasola plicatilis-6","","9/9/16","GP","S","","","Photos backed up on CDs 99-102","","","","","",NA,1566,"","",0
